{
  "$schema": "http://json-schema.org/draft-04/schema#",
  "type": "object",
  "properties": {
    "max_distance": {
      "type": "integer"
    },
    "path": {
      "type": "object",
      "properties": {
        "apply": {
          "type": "boolean"
        },
        "subnet": {
          "type": "integer"
        },
        "organization": {
          "type": "number"
        },
        "contact": {
          "type": "number"
        }
      },
      "required": [
        "apply",
        "subnet",
        "organization",
        "contact"
      ]
    },
    "os": {
      "type": "object",
      "properties": {
        "apply": {
          "type": "boolean"
        },
        "critical_bound": {
          "type": "number"
        },
        "vendor": {
          "type": "number"
        },
        "product": {
          "type": "number"
        },
        "version": {
          "type": "number"
        },
        "diff_value": {
          "type": "number"
        }
      },
      "required": [
        "apply",
        "critical_bound",
        "vendor",
        "product",
        "version",
        "diff_value"
      ]
    },
    "antivirus": {
      "type": "object",
      "properties": {
        "apply": {
          "type": "boolean"
        },
        "critical_bound": {
          "type": "number"
        },
        "vendor": {
          "type": "number"
        },
        "product": {
          "type": "number"
        },
        "version": {
          "type": "number"
        },
        "diff_value": {
          "type": "number"
        }
      },
      "required": [
        "apply",
        "critical_bound",
        "vendor",
        "product",
        "version",
        "diff_value"
      ]
    },
    "cms": {
      "type": "object",
      "properties": {
        "apply": {
          "type": "boolean"
        },
        "critical_bound": {
          "type": "number"
        },
        "vendor": {
          "type": "number"
        },
        "product": {
          "type": "number"
        },
        "version": {
          "type": "number"
        },
        "require_open_http": {
          "type": "boolean"
        },
        "diff_value": {
          "type": "number"
        }
      },
      "required": [
        "apply",
        "critical_bound",
        "vendor",
        "product",
        "version",
        "require_open_http",
        "diff_value"
      ]
    },
    "net_service": {
      "type": "object",
      "properties": {
        "apply": {
          "type": "boolean"
        },
        "critical_bound": {
          "type": "number"
        },
        "diff_value": {
          "type": "number"
        }
      },
      "required": [
        "apply",
        "critical_bound",
        "diff_value"
      ]
    },
    "cve_cumulative": {
      "type": "object",
      "properties": {
        "apply": {
          "type": "boolean"
        },
        "critical_bound": {
          "type": "number"
        },
        "zero_value": {
          "type": "number"
        }
      },
      "required": [
        "apply",
        "critical_bound",
        "zero_value"
      ]
    },
    "event_cumulative": {
      "type": "object",
      "properties": {
        "apply": {
          "type": "boolean"
        },
        "critical_bound": {
          "type": "number"
        },
        "zero_value": {
          "type": "number"
        }
      },
      "required": [
        "apply",
        "critical_bound",
        "zero_value"
      ]
    }
  },
  "required": [
    "max_distance",
    "path",
    "os",
    "antivirus",
    "cms",
    "net_service",
    "cve_cumulative",
    "event_cumulative"
  ]
}