{
    "max_distance": 4,
    "path": {
        "apply": true,
        "subnet": 1,
        "organization": 0.9,
        "contact": 0.8
    },
    "os": {
        "apply": true,
        "critical_bound": 0.17027579,
        "vendor": 0.7,
        "product": 0.2,
        "version": 0.1,
        "diff_value": 0.3
    },
    "antivirus": {
        "apply": true,
        "critical_bound": 0.16666667,
        "vendor": 0.6,
        "product": 0.25,
        "version": 0.15,
        "diff_value": 0.7
    },
    "cms": {
        "apply": true,
        "critical_bound": 0.08161032,
        "vendor": 0.5,
        "product": 0.3,
        "version": 0.2,
        "require_open_http": false,
        "diff_value": 0.8
    },
    "net_service": {
        "apply": true,
        "critical_bound": 0.4,
        "diff_value": 0.7
    },
    "cve_cumulative": {
        "apply": true,
        "critical_bound": 0.29492334,
        "zero_value": 0.9
    },
    "event_cumulative": {
        "apply": true,
        "critical_bound": 0.00036752,
        "zero_value": 0.9
    }
}